{
  "formatVersion": "jiandu.import-plan/v1alpha1",
  "sourceStoreId": "019d2a4a-7b00-7000-8000-000000000019",
  "bundleDigest": "sha256:72cdb84afa2d2c830080610c6dac8a895bf20e3301ff65fd8adad005dbebf926",
  "targetStoreId": "7d7c3ef0-332e-43e8-b2c9-b96f6c107a32",
  "targetSnapshot": {
    "storeRevision": 0,
    "auditSequence": 0
  },
  "scopes": [
    {
      "scope": {
        "kind": "project",
        "projectId": "prj_portable_export"
      },
      "authorized": true
    },
    {
      "scope": {
        "kind": "session",
        "sessionId": "ses_portable_export"
      },
      "authorized": true
    }
  ],
  "entries": [
    {
      "kind": "record",
      "memoryId": "mem_portable_a_range",
      "scope": {
        "kind": "session",
        "sessionId": "ses_portable_export"
      },
      "classification": "accepted"
    },
    {
      "kind": "record",
      "memoryId": "mem_portable_complete",
      "scope": {
        "kind": "project",
        "projectId": "prj_portable_export"
      },
      "classification": "accepted"
    },
    {
      "kind": "tombstone",
      "memoryId": "mem_portable_forgotten",
      "scope": {
        "kind": "project",
        "projectId": "prj_portable_export"
      },
      "classification": "accepted"
    }
  ],
  "counts": {
    "accepted": 3,
    "conflicting": 0,
    "unauthorized": 0,
    "tombstoneProtected": 0,
    "invalid": 0
  },
  "committable": true,
  "digest": "sha256:835852da5a1b92732e3d689c547a95e85fbddd6ac02c1cfe80db72ecb72884fd"
}
